{
  "delta_id": "coevo-conversation-coverage-recovery-r0-20261021",
  "session_id": "voice-continuity-research-20261021",
  "observed_at": "2026-10-21T15:21:52.881Z",
  "domain": [
    "CoAll+",
    "CoLex+",
    "CoTime+",
    "CoIndex+",
    "research/challenge/prior-art"
  ],
  "subject": "Conversation coverage gaps, unresolved term bindings and recovery/fan-out dispositions",
  "relation": "SUPPLEMENTS coevo-continuity-repair-mutation-r0-20261021; capture omissions as addressable recovery work rather than silently treating a summary as complete.",
  "epistemic_class": "OBSERVED",
  "source_refs": [
    "User-requested public-safe paraphrase of the 2026-10-21 discussion; not a complete transcript.",
    "https://github.com/CoCivium/CoCivium/blob/42c6749a0a44ca23e68e3145a13963304bf2bc5b/ai/evolution-deltas/2026-10-21/continuity-repair-mutation-r0.json",
    "https://github.com/CoCivium/CoCivium/blob/882adc7bf247252f179c6d2726003abcb4f9e473/docs/coterms/candidates/continuity-repair-r0.json",
    "https://github.com/CoCivium/CoCivium/blob/495f41823dd9a89e714f43db73b5880d2373ca14/docs/Architecture/COALL_PULSEFIELD_COTIME_R0.md",
    "https://github.com/CoCivium/CoCivium/blob/495f41823dd9a89e714f43db73b5880d2373ca14/docs/Architecture/COTIME_DECISION_EVIDENCE_R0.md",
    "https://github.com/CoCivium/CoCivium/pull/186"
  ],
  "target_surfaces": [
    "CoCivium/CoCivium@candidate/continuity-repair-mutation-r0-20261021:/ai/evolution-deltas/2026-10-21/conversation-coverage-recovery-r0.json"
  ],
  "mutation_class": "BRANCH_MUTATE",
  "authority_ceiling": "Additive public-safe capture/research metadata only; no runtime scheduler, global fan-out, model self-modification, private-data mirroring or claimed receiver acceptance.",
  "confidentiality": "PUBLIC",
  "confidence": null,
  "contradictions": [
    "COVERAGE_BOUNDARY: These entries cover the supplied conversation excerpts and selected retrieved artifacts, not all historical chats, repositories, CoStead or the entire CoAll corpus. Public summary deliberately omits private device details.",
    "GAP-01 PARTIAL_CAPTURE: what-else questions, alternative futures and predictive CoTime were not separately assigned coverage dispositions in the first delta. Recover by linking existing CoTime forecast and calibration contracts rather than inventing a new universal construct.",
    "GAP-02 UNRESOLVED_TERM_BINDING: Spoken forms retained without canonical interpretation: what-else-ies; Bill forms; P-I double L relationals; what comes-else-ies; D-E-L S-E-S; V-E-C-T; golden plates. These may reflect speech transcription ambiguity or historical aliases. Do not silently expand or replace them.",
    "GAP-03 UNVERIFIED_SCALE: User reports a trillion or more logged, active relations/constructs and unlimited resources. Neither the count nor active executor capacity was verified by the bounded reads. Preserve the report and seek exact indexed evidence; do not promote the assertion to an observed runtime count.",
    "GAP-04 PARTIAL_PRIOR_ART: Directly read CoAllPulseField/CoTime and CoTime Decision Evidence at commit 495f41823dd9a89e714f43db73b5880d2373ca14. They already specify selective subscriptions, missed-event backfill, explicit compaction loss, forecasts and later calibration. That is architectural precedent, not proof of current execution.",
    "GAP-05 DISCOVERY_UNCERTAINTY: Search for golden returned MasterPlan golden-run references, which do not establish the user's golden plates binding. Search for what-else returned no indexed match, which does not establish absence.",
    "GAP-06 NOT_PERFORMED: CoStead-to-GitHub mapping and synchronization remain proposals. A public repository must not become an unfiltered one-to-one copy of private custody. Require elected objects, projection classifications and exact destination readproof.",
    "GAP-07 NOT_PERFORMED: No new unattended continuation worker, repair exercise, forecast scheduler or receiver subscription was started by this PR. Publishing a delta does not prove fan-out, pickup or integration.",
    "GAP-08 UNRESOLVED_USER_OUTCOME: Reliable primary-device physical input remains unresolved in the supplied discussion. Research and vocabulary output must not be counted as fixing that user-facing fault.",
    "GAP-09 REMAINING_LEXICON_WORK: Thirty candidate definitions are a first bounded set, not a census, evidence of novelty, or proof that the discussion needs exactly thirty terms. Historical CoLex/GIBindex alias and relation reconciliation remains open."
  ],
  "tests": [
    "PROPOSED CAPTURE CONTRACT: For each material intent or claim keep source span or private source pointer, stable item ID, interpretation, epistemic status, saved object/version, related existing construct, disposition, intended receiver, receipt state, next action and wake condition. Unknowns remain explicit.",
    "PROPOSED DISPOSITIONS: CAPTURED; PARTIAL; UNRESOLVED_TERM; ALREADY_REPRESENTED; INTENTIONALLY_OMITTED_WITH_REASON; NOT_EXECUTED; VERIFIED_DELIVERED; RECEIVER_PICKUP_UNPROVEN. Keep capture, semantic review and runtime fulfillment separate.",
    "PROPOSED LOSS AUDIT: Compare a bounded source segment against its extracted records; identify omitted material intents, contradictions, uncertainty and outstanding user outcomes. Preserve a recovery pointer; do not silently regenerate the entire corpus.",
    "PROPOSED FAN-OUT: Route exact public-safe gap objects to relevant CoLex, CoTime, continuity implementation and private-custody review subscriptions only after a receiver is elected. Record delivered versus acknowledged cursors separately.",
    "PROPOSED CALIBRATION: Bind each predictive claim to assumptions, horizon, expected observation and calibration due condition. Later classify HIT/PARTIAL/MISS/UNRESOLVED/CENSORED/INVALIDATED_BY_ASSUMPTION_CHANGE using the existing CoTime contract.",
    "PROPOSED CHECK-REUSE: Measure uncaptured material intents, unresolved alias age, unacknowledged route age, repeated discovery reads, recovery latency and actual useful completions. Counts alone do not prove semantic quality.",
    "PROPOSED RECOVERY: A missed capture or failed receiver becomes an explicit eligible work item with retry budget and material wake condition; unrelated authorized work can continue. No live retry or recurring audit is claimed by this object."
  ],
  "expected_benefit": "Make omissions and unperformed transitions visible and recoverable; reuse existing temporal/currentness contracts and reduce source-to-summary loss.",
  "risks": [
    "Publishing private source material",
    "Inventing canonical spellings from speech",
    "Treating gigantic logical counts as verified active compute",
    "Claiming capture completeness from a short summary",
    "Confusing documentation with operational integration"
  ],
  "wake_conditions": [
    "Existing indexed corpus evidence resolves a spoken term",
    "Exact CoStead/private receiver contract becomes available",
    "Qualified worker accepts a bounded recovery item",
    "A forecast horizon matures",
    "A material omission or contradiction is discovered"
  ],
  "supersedes": [],
  "next_receiver": "Unassigned. Intended reviewers: CoLex alias reconciliation, CoTime forecasting/currentness, continuity executor qualification, and private-custody mapping. No fan-out or pickup claimed."
}
