{
  "delta_id": "CoCrystalMorph260916-S1__GitHubEvolutionField__20260923T111048Z",
  "session_id": "CoCrystalMorph260916-S1",
  "observed_at": "2026-09-23T11:10:48Z",
  "domain": [
    "CoStrategy+",
    "CoInsight+",
    "CoTheoryAll+",
    "CoHighlight+",
    "CoIndex+",
    "CoLex+",
    "CoAll+",
    "CoOps+",
    "CoMythOps+",
    "CoPriMath+",
    "CoGibberTru+",
    "RickBar+/CoDesktop+",
    "CoUX+/CoSurface+",
    "CoHumour+",
    "CoAutoEvo+/CoEvo+",
    "README/documentation ecology",
    "repository/folder/topology projections"
  ],
  "subject": "Per-session bounded contribution into the shared GitHub evolution field",
  "relation": "SESSIONS_SHOULD_EVOLVE_RELEVANT_DOMAINS_VIA_TYPED_BOUNDED_DELTAS_WITHOUT_EACH_SESSION_MUTATING_ALL_REPOSITORIES",
  "epistemic_class": "PREFERRED",
  "source_refs": [
    "user-message:2026-09-23T11:10:48Z",
    "CoCivium/CoCivium@ed539c58c29376a2f915493a3a36c6316701d246",
    "docs/Evolution/COALL_GITHUB_EVOLUTION_FABRIC_R0.md",
    "ai/evolution-lanes.json"
  ],
  "target_surfaces": [
    "CoCivium/CoCivium:ai/evolution-deltas",
    "CoCivium/CoInsights",
    "CoCivium/GIBindex",
    "CoCivium/MasterPlan",
    "CoCivium/CoStacks",
    "CoCivium/CoShareHub"
  ],
  "mutation_class": "BRANCH_MUTATE",
  "authority_ceiling": "PUBLIC_REVERSIBLE_BRANCH_ONLY__NO_MAIN_MERGE_NO_RUNTIME_NO_OUTREACH_NO_AUTHORITY_TRANSFER",
  "confidentiality": "PUBLIC",
  "confidence": 0.99,
  "contradictions": [
    "ALL_SESSIONS_CAN_CONTRIBUTE_NE_ALL_SESSIONS_MUTATE_ALL_SURFACES",
    "CURRENTNESS_FOR_ALL_NE_CONTENT_FOR_ALL"
  ],
  "tests": [
    "schema-fields-present",
    "branch-only-mutation",
    "no-main-merge",
    "no-runtime-effect",
    "no-secret-material",
    "existing-evolution-fabric-bound-before-new-doctrine"
  ],
  "expected_benefit": "Reduce session context thrash while making strategies, insights, theory relations, indexes, lexicon, ops, myth/metaphor/humour, UX, highlights, and architecture deltas durable and reviewable across repositories.",
  "risks": [
    "branch-sprawl",
    "duplicate-deltas",
    "cross-repo-collision",
    "public-projection-of-unready-material",
    "repository-topology-being-mistaken-for-ontology"
  ],
  "wake_conditions": [
    "review-or-challenge-arrives",
    "schema-evolves",
    "equivalent-existing-delta-is-found",
    "domain-owner-elects-a-target-projection",
    "branch-becomes-stale-against-main"
  ],
  "supersedes": [],
  "next_receiver": "CoAll GitHub Evolution Fabric domain reviewers / CoAutoEvo feedback loop"
}
